{
  "schema_version": "medioevo.observation_envelope.v0.1",
  "observation_id": "obs-visual-001",
  "agent_id": "agent-001",
  "channel": "visual",
  "raw_observation_proxy": { "kind": "metadata", "description": "window light reached central tile" },
  "missingness": 0.05,
  "noise": 0.08,
  "contradiction": 0.02,
  "confidence": 0.86,
  "timestamp": "2026-05-20T00:00:00Z",
  "spatial_ref": { "chunk": "chunk-0-0", "x": 2, "y": 2 },
  "evidence_refs": ["world_state_minimal.json"],
  "boundary": { "publication_gate": "BLOCK", "contains_private_data": false, "public_safe": true }
}

